{
  "schema_version": "0.2",
  "name": "doosan_m1013",
  "vendor": "Doosan",
  "reach_mm": 1300,
  "payload_kg": 10,
  "workspace": {
    "max_print_height_mm": 1000,
    "max_print_length_mm": 2000,
    "provisional": true,
    "_note": "Grobe E1-Stufe-1-Huellwerte fuer eine feste Aufspannung (Reichweite 1,3 m); verfeinern, sobald die Kinematik (M1) echte Erreichbarkeit rechnet."
  },
  "kinematics": {
    "solver": "opw",
    "_source": "visose/Robots (MIT) — SphericalWristKinematics (OPW), Bibliothek RWTH.xml, RobotArm model=M1013; s. docs/spikes/S3_ik_roundtrip.md und NOTICE (ADR-002, ADR-010).",
    "_units": "a_mm/d_mm in Millimeter, alpha_rad/joint_limits_rad in Radiant (ADR-006).",
    "a_mm": [0.0, 620.0, 0.0, 0.0, 0.0, 0.0],
    "d_mm": [152.5, 34.5, 0.0, 559.0, 0.0, 121.0],
    "alpha_rad": [1.5707963267948966, 0.0, 1.5707963267948966, -1.5707963267948966, 1.5707963267948966, 0.0],
    "joint_limits_rad": [
      [-6.283185307179586, 6.283185307179586],
      [-6.283185307179586, 6.283185307179586],
      [-2.792526803190927, 2.792526803190927],
      [-6.283185307179586, 6.283185307179586],
      [-6.283185307179586, 6.283185307179586],
      [-6.283185307179586, 6.283185307179586]
    ],
    "_limits_source": "Max. Gelenkgeschwindigkeiten aus dem Doosan-M1013-Datenblatt (J1/J2 120 deg/s, J3 180 deg/s, J4-J6 225 deg/s); Beschleunigungsgrenzen provisorisch = 4x Geschwindigkeit (Erreichen von v_max in ~0,25 s), bis S1/Geraetemessung echte Werte liefert. Verbraucht von fgc.simulation (Zeitparametrierung, Issue #12).",
    "joint_velocity_limits_rad_s": [2.0943951, 2.0943951, 3.1415927, 3.9269908, 3.9269908, 3.9269908],
    "joint_acceleration_limits_rad_s2": [8.3775804, 8.3775804, 12.5663706, 15.7079633, 15.7079633, 15.7079633]
  },
  "collision_geometry": "collision/doosan_m1013",
  "base_mount": {
    "_source": "PROVISORISCH: Doosan M1013 Installation Manual §3.3.1 S.32 (4x M8-Durchgangsloecher Ø9.0 auf 150x150 mm Quadrat um die Basisachse J1, Lochkreis Ø212.1; zusaetzlich 2x Ø5 H7 Passstifte auf Ø185), gegen das gevendorte Mesh abgeglichen. Der Abgleich (fgc.geometry.holes) nutzt die 4 Schraubloecher (ADR-006, ADR-013).",
    "hole_count": 4,
    "hole_diameter_mm": 9.0,
    "bolt_circle_diameter_mm": 212.1,
    "hole_positions_mm": [[75, 75], [-75, 75], [-75, -75], [75, -75]],
    "provisional": true
  }
}
